{
  "schemaVersion": 1,
  "kind": "shared-library",
  "id": "localogue.example.community",
  "name": "Localogue 示例共享资料包",
  "version": "2026.09.0",
  "description": "用于学习 Shared Pack 与 Local Override 优先级的完全虚构资料。",
  "languages": [
    "ja",
    "zh-CN",
    "en"
  ],
  "license": "CC0-1.0",
  "createdAt": "2026-09-02T09:00:00+08:00"
}
